{
  "admissibility_threshold_theta": "Integer(1)",
  "author": "Frédéric Tabary — Institut IA Inc. / Coherence Labs",
  "canonical_equation": {
    "ascii": "S = (beta * dPhi)/(1 + T + sigma)",
    "residual_ascii": "S*(1 + T + sigma) - beta*dPhi = 0",
    "unicode": "S = (β × ΔΦ)/(1 + T + σ)"
  },
  "counts": {
    "by_category": {
      "ADMISSIBILITY": 6,
      "CROSS_EXPANDED": 2,
      "CROSS_FACTORED": 2,
      "ENERGY": 2,
      "ISOLATION": 10,
      "LOGARITHMIC": 3,
      "PROPORTION": 8,
      "RATIONAL_CANONICAL": 2,
      "ZERO_RESIDUAL": 8
    },
    "by_classification": {
      "CORE": 38,
      "DERIVED": 5
    },
    "oriented_forms": 43,
    "rejected_forms": 5,
    "renderings": 172,
    "semantic_classes": 8
  },
  "engine_version": "s-add-v2-variant-engine-1.0.0",
  "exhaustiveness_claim": "Exhaustif dans FORM_GRAMMAR_V1.",
  "grammar_id": "FORM_GRAMMAR_V1",
  "grammar_version": "1.0.0",
  "rejected_historical_forms": [
    {
      "classification_result": "HISTORIQUE_NON_CANONIQUE",
      "denominator_strictly_additive": false,
      "expression_unicode": "ΔΦ*β/(T*σ)",
      "id": "HIST_MULTIPLICATIVE",
      "reason": "dénominateur multiplicatif, singulier en T=0 ou σ=0",
      "status": "HISTORIQUE_NON_CANONIQUE"
    },
    {
      "classification_result": "HISTORIQUE_NON_CANONIQUE",
      "denominator_strictly_additive": false,
      "expression_unicode": "ΔΦ*β/(T + σ)",
      "id": "HIST_ADDITIVE_NO_UNIT",
      "reason": "terme unité absent, singulier en T=σ=0",
      "status": "HISTORIQUE_NON_CANONIQUE"
    },
    {
      "classification_result": "HISTORIQUE_NON_CANONIQUE",
      "denominator_strictly_additive": true,
      "expression_unicode": "10*ΔΦ*β/(T + σ + 1)",
      "id": "HIST_SCALED_10",
      "reason": "facteur d'échelle artificiel, déplace le seuil S = 1",
      "status": "HISTORIQUE_NON_CANONIQUE"
    },
    {
      "classification_result": "HISTORIQUE_NON_CANONIQUE",
      "denominator_strictly_additive": true,
      "expression_unicode": "100*ΔΦ*β/(T + σ + 1)",
      "id": "HIST_SCALED_100",
      "reason": "facteur d'échelle artificiel, déplace le seuil S = 1",
      "status": "HISTORIQUE_NON_CANONIQUE"
    },
    {
      "classification_result": "HISTORIQUE_NON_CANONIQUE",
      "denominator_strictly_additive": false,
      "expression_unicode": "(ΔΦ*β + 1)/(T + σ)",
      "id": "HIST_UNIT_IN_NUMERATOR",
      "reason": "terme unité déplacé au numérateur",
      "status": "HISTORIQUE_NON_CANONIQUE"
    }
  ],
  "saturation_rounds": [
    {
      "known_before": 1,
      "new_form_categories": [
        "CROSS_EXPANDED",
        "CROSS_FACTORED",
        "ENERGY",
        "ISOLATION",
        "LOGARITHMIC",
        "PROPORTION",
        "RATIONAL_CANONICAL",
        "ZERO_RESIDUAL"
      ],
      "new_forms": 21,
      "round": 1
    },
    {
      "known_before": 22,
      "new_form_categories": [
        "CROSS_EXPANDED",
        "CROSS_FACTORED",
        "ISOLATION",
        "PROPORTION",
        "ZERO_RESIDUAL"
      ],
      "new_forms": 15,
      "round": 2
    },
    {
      "known_before": 37,
      "new_form_categories": [],
      "new_forms": 0,
      "round": 3
    },
    {
      "attestation": "SECOND_EMPTY_ROUND",
      "known_before": 37,
      "new_form_categories": [],
      "new_forms": 0,
      "round": 4
    }
  ],
  "semantic_classes": [
    "0d66d95d441c05de87b3b14de0812ccf2d6c7e82fe36d042cd29c95784ddd954",
    "37464c7eb12fbdd52119fb742dfa7f744d82a843aeb41372eb24a103430b4b6b",
    "48e55e2c84b1c377b910a4c75bad7b0d6af3416b01fc066304c8aee272b600de",
    "56571c0880250d60ee01abc1f660b5ad5eec01abd8ab88ec819787716d3179a2",
    "78396a584012115ae427676d20a1a6450001c9e8ba67d8ad8e2297c1a1811d7f",
    "7d00c56c476f955f1737e4429bd962a85b23c24abd631dc437898b59ef47587e",
    "b8e71afc933d7cca822fd9dbecc260f62d96b5412a1c21e5474556416a96b1b0",
    "dd98c2b5b980452254ad3f2fd4d4f3dd027c1141be05da8aad5131eeea30ed08"
  ],
  "source_doi": "10.5281/zenodo.17559249",
  "variants": [
    {
      "category": "RATIONAL_CANONICAL",
      "classification": "CORE",
      "domain_guards": [
        "1 + T + sigma != 0"
      ],
      "equivalence_proof": {
        "method": "SUBSTITUTION_S_EQ_CANONICAL_RHS",
        "residual_after_substitution": "Integer(0)",
        "statement": "lhs − rhs ≡ 0 après substitution de S = (β·ΔΦ)/(1+T+σ)",
        "verified": true
      },
      "expression_ascii": "S = dPhi*beta/(T + sigma + 1)",
      "expression_latex": "S = \\frac{\\Delta\\Phi \\beta}{T + \\sigma + 1}",
      "expression_unicode": "S = ΔΦ*β/(T + σ + 1)",
      "grammar_id": "FORM_GRAMMAR_V1",
      "grammar_version": "1.0.0",
      "orientation": "DIRECT",
      "relation": "Eq",
      "rule_id": "SEED",
      "semantic_sha256": "48e55e2c84b1c377b910a4c75bad7b0d6af3416b01fc066304c8aee272b600de",
      "solved_for": "S",
      "source_doi": "10.5281/zenodo.17559249",
      "status": "PASS",
      "sympy_serialization": "{\"lhs\":\"Symbol('S', real=True)\",\"relation\":\"Eq\",\"rhs\":\"Mul(Symbol('DeltaPhi', real=True), Symbol('beta', real=True), Pow(Add(Symbol('T', real=True), Symbol('sigma', real=True), Integer(1)), Integer(-1)))\"}",
      "terminal": false,
      "variant_id": "SADDV2-RATIONAL_CANONICAL-001"
    },
    {
      "category": "RATIONAL_CANONICAL",
      "classification": "CORE",
      "domain_guards": [
        "1 + T + sigma != 0"
      ],
      "equivalence_proof": {
        "method": "SUBSTITUTION_S_EQ_CANONICAL_RHS",
        "residual_after_substitution": "Integer(0)",
        "statement": "lhs − rhs ≡ 0 après substitution de S = (β·ΔΦ)/(1+T+σ)",
        "verified": true
      },
      "expression_ascii": "dPhi*beta/(T + sigma + 1) = S",
      "expression_latex": "\\frac{\\Delta\\Phi \\beta}{T + \\sigma + 1} = S",
      "expression_unicode": "ΔΦ*β/(T + σ + 1) = S",
      "grammar_id": "FORM_GRAMMAR_V1",
      "grammar_version": "1.0.0",
      "orientation": "INVERSE",
      "relation": "Eq",
      "rule_id": "R01_SWAP_ORIENTATION",
      "semantic_sha256": "48e55e2c84b1c377b910a4c75bad7b0d6af3416b01fc066304c8aee272b600de",
      "solved_for": "S",
      "source_doi": "10.5281/zenodo.17559249",
      "status": "PASS",
      "sympy_serialization": "{\"lhs\":\"Mul(Symbol('DeltaPhi', real=True), Symbol('beta', real=True), Pow(Add(Symbol('T', real=True), Symbol('sigma', real=True), Integer(1)), Integer(-1)))\",\"relation\":\"Eq\",\"rhs\":\"Symbol('S', real=True)\"}",
      "terminal": false,
      "variant_id": "SADDV2-RATIONAL_CANONICAL-002"
    },
    {
      "category": "CROSS_FACTORED",
      "classification": "CORE",
      "domain_guards": [],
      "equivalence_proof": {
        "method": "SUBSTITUTION_S_EQ_CANONICAL_RHS",
        "residual_after_substitution": "Integer(0)",
        "statement": "lhs − rhs ≡ 0 après substitution de S = (β·ΔΦ)/(1+T+σ)",
        "verified": true
      },
      "expression_ascii": "S*(T + sigma + 1) = dPhi*beta",
      "expression_latex": "S \\left(T + \\sigma + 1\\right) = \\Delta\\Phi \\beta",
      "expression_unicode": "S*(T + σ + 1) = ΔΦ*β",
      "grammar_id": "FORM_GRAMMAR_V1",
      "grammar_version": "1.0.0",
      "orientation": "DIRECT",
      "relation": "Eq",
      "rule_id": "R04_FACTOR",
      "semantic_sha256": "48e55e2c84b1c377b910a4c75bad7b0d6af3416b01fc066304c8aee272b600de",
      "solved_for": null,
      "source_doi": "10.5281/zenodo.17559249",
      "status": "PASS",
      "sympy_serialization": "{\"lhs\":\"Mul(Symbol('S', real=True), Add(Symbol('T', real=True), Symbol('sigma', real=True), Integer(1)))\",\"relation\":\"Eq\",\"rhs\":\"Mul(Symbol('DeltaPhi', real=True), Symbol('beta', real=True))\"}",
      "terminal": false,
      "variant_id": "SADDV2-CROSS_FACTORED-001"
    },
    {
      "category": "CROSS_FACTORED",
      "classification": "CORE",
      "domain_guards": [],
      "equivalence_proof": {
        "method": "SUBSTITUTION_S_EQ_CANONICAL_RHS",
        "residual_after_substitution": "Integer(0)",
        "statement": "lhs − rhs ≡ 0 après substitution de S = (β·ΔΦ)/(1+T+σ)",
        "verified": true
      },
      "expression_ascii": "dPhi*beta = S*(T + sigma + 1)",
      "expression_latex": "\\Delta\\Phi \\beta = S \\left(T + \\sigma + 1\\right)",
      "expression_unicode": "ΔΦ*β = S*(T + σ + 1)",
      "grammar_id": "FORM_GRAMMAR_V1",
      "grammar_version": "1.0.0",
      "orientation": "INVERSE",
      "relation": "Eq",
      "rule_id": "R01_SWAP_ORIENTATION",
      "semantic_sha256": "48e55e2c84b1c377b910a4c75bad7b0d6af3416b01fc066304c8aee272b600de",
      "solved_for": null,
      "source_doi": "10.5281/zenodo.17559249",
      "status": "PASS",
      "sympy_serialization": "{\"lhs\":\"Mul(Symbol('DeltaPhi', real=True), Symbol('beta', real=True))\",\"relation\":\"Eq\",\"rhs\":\"Mul(Symbol('S', real=True), Add(Symbol('T', real=True), Symbol('sigma', real=True), Integer(1)))\"}",
      "terminal": false,
      "variant_id": "SADDV2-CROSS_FACTORED-002"
    },
    {
      "category": "CROSS_EXPANDED",
      "classification": "CORE",
      "domain_guards": [],
      "equivalence_proof": {
        "method": "SUBSTITUTION_S_EQ_CANONICAL_RHS",
        "residual_after_substitution": "Integer(0)",
        "statement": "lhs − rhs ≡ 0 après substitution de S = (β·ΔΦ)/(1+T+σ)",
        "verified": true
      },
      "expression_ascii": "S*T + S*sigma + S = dPhi*beta",
      "expression_latex": "S T + S \\sigma + S = \\Delta\\Phi \\beta",
      "expression_unicode": "S*T + S*σ + S = ΔΦ*β",
      "grammar_id": "FORM_GRAMMAR_V1",
      "grammar_version": "1.0.0",
      "orientation": "DIRECT",
      "relation": "Eq",
      "rule_id": "R03_EXPAND",
      "semantic_sha256": "48e55e2c84b1c377b910a4c75bad7b0d6af3416b01fc066304c8aee272b600de",
      "solved_for": null,
      "source_doi": "10.5281/zenodo.17559249",
      "status": "PASS",